Casa Mineira,425978,22/02/2022,Sim,[FS-CM],Secretaria Casa Mineira,3125333000,secretaria@casamineira.com,Sim,,,Apartamento,Rua Marques de Valença,109,30441106,3,301,3,1,1,109,,Não,2,O terceiro quarto foi transformado em closet. Os armários do closet e do quarto do bebê não ficarão no apartamento. A área de serviço foi diminuída para aumentar a cozinha. Porém tem um espaço reservado para uma máquina de lavar.,PROPRIETÁRIO,Sim,Chave Comum,Local da Chave com Secretaria da Casa Mineira,Local da Chave com Secretaria da Casa Mineira,Não,[FS-CM],Sim,790000,730,,Mensalmente,,,,,,893580804,,2022-03-08 23:26,erro-sem_imgs
Casa Mineira,387050,22/02/2022,Sim,[FS-CM],Secretaria Casa Mineira,3125333000,secretaria@casamineira.com,Sim,,,Apartamento,Rua Inácio Parreira Neves,258,30570680,2,304,2,1,2,67,,Não,1,,PROPRIETÁRIO,Sim,Chave Comum,Local da Chave com Secretaria da Casa Mineira,Local da Chave com Secretaria da Casa Mineira,Não,[FS-CM],Sim,280000,250,1015,Mensalmente,,,,,,893580800,,2022-03-08 23:27,ok-img (2022-03-10 19:28:31)
Casa Mineira,400659,22/02/2022,Sim,[FS-CM],Secretaria Casa Mineira,3125333000,secretaria@casamineira.com,Sim,,,Casa,Rua Passa Quatro,432,30775040,,,3,1,3,275,,Não,6,,PROPRIETÁRIO,Sim,Chave Comum,Local da Chave com Secretaria da Casa Mineira,Local da Chave com Secretaria da Casa Mineira,Não,[FS-CM],Sim,760000,,174,Mensalmente,,,,,,893580809,,2022-03-08 23:28,ok-img (2022-03-10 19:30:33)
Casa Mineira,276328,22/02/2022,Sim,[FS-CM],Secretaria Casa Mineira,3125333000,secretaria@casamineira.com,Sim,,,Apartamento,Rua Zurick,540,30421060,3,302,2,0,1,95,,Não,2,Um dos quartos foi transformado em closet e é facilmente reversível.,PROPRIETÁRIO,Sim,Chave Comum,Local da Chave com Secretaria da Casa Mineira,Local da Chave com Secretaria da Casa Mineira,Não,[FS-CM],Sim,330000,627,,Mensalmente,,,,,,893580832,,2022-03-08 23:29,erro-pag_fotos
Casa Mineira,396378,22/02/2022,Sim,[FS-CM],Secretaria Casa Mineira,3125333000,secretaria@casamineira.com,Sim,,,Apartamento,Rua Cristóvão Pinto Ribeiro,143,31555280,1,103,3,1,2,90,,Não,2,,PROPRIETÁRIO,Sim,Chave Comum,Local da Chave com Secretaria da Casa Mineira,Local da Chave com Secretaria da Casa Mineira,Não,[FS-CM],Sim,275000,,,Mensalmente,,,,,,893580845,,2022-03-08 23:30,ok-img (2022-03-10 19:33:54)
Casa Mineira,398527,22/02/2022,Sim,[FS-CM],Secretaria Casa Mineira,3125333000,secretaria@casamineira.com,Sim,,,Apartamento,Rua Milton Vieira Pinto,71,31170080,2,201,4,1,3,140,,Não,2,,PROPRIETÁRIO,Sim,Chave Comum,Local da Chave com Secretaria da Casa Mineira,Local da Chave com Secretaria da Casa Mineira,Não,[FS-CM],Sim,850000,985,195,Mensalmente,,,,,,893580854,,2022-03-08 23:31,ok-img (2022-03-10 19:35:46)
Casa Mineira,417439,22/02/2022,Sim,[FS-CM],Secretaria Casa Mineira,3125333000,secretaria@casamineira.com,Sim,,,Cobertura,Rua Alberto de Oliveira,375,31525120,3,301,4,1,3,236,,Não,4,"Prédio bem conservado, boa localização. Prédio pequeno com entrada lateral. No registro uma vaga de garagem, que cabem dois carros pequenos.",PROPRIETÁRIO,Sim,Chave Comum,Local da Chave com Secretaria da Casa Mineira,Local da Chave com Secretaria da Casa Mineira,Não,[FS-CM],Sim,665000,250,148,Mensalmente,,,,,,1,Elemento não encontrado na pagina 'Detalhe do imovel',,
Casa Mineira,345394,22/02/2022,Sim,[FS-CM],Secretaria Casa Mineira,3125333000,secretaria@casamineira.com,Sim,,,Apartamento,Rua Turquesa,448,30411177,3,301,4,1,3,113,,Não,2,Área privativa com teto retrátil.,PROPRIETÁRIO,Sim,Chave Comum,Local da Chave com Secretaria da Casa Mineira,Local da Chave com Secretaria da Casa Mineira,Não,[FS-CM],Sim,850000,728,282,Mensalmente,,,,,,893580878,,2022-03-08 23:33,ok-img (2022-03-10 19:38:19)
Casa Mineira,100605,22/02/2022,Sim,[FS-CM],Secretaria Casa Mineira,3125333000,secretaria@casamineira.com,Sim,,,Flat,RUA GUAICUI,596,30380342,,1013,1,1,2,63,,Não,1,,PROPRIETÁRIO,Sim,Chave Comum,Local da Chave com Secretaria da Casa Mineira,Local da Chave com Secretaria da Casa Mineira,Não,[FS-CM],Sim,695000,,,Mensalmente,,,,,,1,Elemento não encontrado na pagina 'Detalhe do imovel',,
Casa Mineira,398163,22/02/2022,Sim,[FS-CM],Secretaria Casa Mineira,3125333000,secretaria@casamineira.com,Sim,,,Apartamento,Rua José Silva Passos,300,31070022,11,1103 E,3,1,2,96,,Não,2,,PROPRIETÁRIO,Sim,Chave Comum,Local da Chave com Secretaria da Casa Mineira,Local da Chave com Secretaria da Casa Mineira,Não,[FS-CM],Sim,550000,,,Mensalmente,,,,,,E,,,
Casa Mineira,374670,22/02/2022,Sim,[FS-CM],Secretaria Casa Mineira,3125333000,secretaria@casamineira.com,Sim,,,Apartamento,Rua Adauto Feitosa,85,31260340,3,303,2,0,1,49,,Não,1,"Apto novo, 03 Qts sendo 02 suites, sala 2 amb., banheiro social, cozinha, área serviço e banho.",PROPRIETÁRIO,Sim,Chave Comum,Local da Chave com Secretaria da Casa Mineira,Local da Chave com Secretaria da Casa Mineira,Não,[FS-CM],Sim,280000,,75,Mensalmente,,,,,,893580903,,2022-03-08 23:37,erro-pag_fotos
Casa Mineira,229033,22/02/2022,Sim,[FS-CM],Secretaria Casa Mineira,3125333000,secretaria@casamineira.com,Sim,,,Casa,PADRE NÓBREGA,208,30730230,,,4,1,2,218,,Não,2,,PROPRIETÁRIO,Sim,Chave Comum,Local da Chave com Secretaria da Casa Mineira,Local da Chave com Secretaria da Casa Mineira,Não,[FS-CM],Sim,880000,,155,Mensalmente,,,,,,893580925,,2022-03-08 23:38,erro-pag_fotos
Casa Mineira,341699,22/02/2022,Sim,[FS-CM],Secretaria Casa Mineira,3125333000,secretaria@casamineira.com,Sim,,,Apartamento,Rua Professor Otto Cirne,81,30380610,4,401 - Torre 2,3,1,2,80,,Não,2,,PROPRIETÁRIO,Sim,Chave Comum,Local da Chave com Secretaria da Casa Mineira,Local da Chave com Secretaria da Casa Mineira,Não,[FS-CM],Sim,680000,850,309,Mensalmente,,,,,,893580938,,2022-03-08 23:39,ok-img (2022-03-10 19:42:22)
Casa Mineira,431281,22/02/2022,Sim,[FS-CM],Secretaria Casa Mineira,3125333000,secretaria@casamineira.com,Sim,,,Casa,Rua Almirante Alexandrino,94,30441036,,,4,0,3,320,,Não,4,,PROPRIETÁRIO,Sim,Chave Comum,Local da Chave com Secretaria da Casa Mineira,Local da Chave com Secretaria da Casa Mineira,Não,[FS-CM],Sim,3700000,,,Mensalmente,,,,,,E,,,
Casa Mineira,371553,22/02/2022,Sim,[FS-CM],Secretaria Casa Mineira,3125333000,secretaria@casamineira.com,Sim,,,Apartamento,Rua São Mateus,480,31035330,4,406 - Bloco 2,2,0,1,50,,Não,1,"Uma casa composta por duas salas, três quartos, dois banhos, sendo uma suíte e cozinha no nível da rua e outra casa abaixo com dois quartos, um banho e cozinha.  RELACIONAMENTOS ATENÇÃO >>>> NAO INSTALAR PLACA E ADESIVO NO NUMERO 161 CASA DO PORTAO ESCURO >>>>> IMOVEL A VENDA (PORTAO BRANCO)",PROPRIETÁRIO,Sim,Chave Comum,Local da Chave com Secretaria da Casa Mineira,Local da Chave com Secretaria da Casa Mineira,Não,[FS-CM],Sim,230000,238,,Mensalmente,,,,,,893580959,,2022-03-08 23:42,ok-img (2022-03-10 19:43:52)
Casa Mineira,348248,22/02/2022,Sim,[FS-CM],Secretaria Casa Mineira,3125333000,secretaria@casamineira.com,Sim,,,Apartamento,Rua São Paulo,2500,30170137,6,603,4,1,3,136,,Não,2,"Acabamento de luxo; Preparação para ar condicionado na sala e quartos; Venezianas integradas; Piso dos quartos em laminado vinílico; Portaria virtual 24h; 4 vagas de garagem cobertas sob pilotis (2 duplas - n° 76, 77, 78 e 79)",PROPRIETÁRIO,Sim,Chave Comum,Local da Chave com Secretaria da Casa Mineira,Local da Chave com Secretaria da Casa Mineira,Não,[FS-CM],Sim,1300000,1150,400,Mensalmente,,,,,,E,,,
Casa Mineira,388835,22/02/2022,Sim,[FS-CM],Secretaria Casa Mineira,3125333000,secretaria@casamineira.com,Sim,,,Apartamento,Rua dos Aeroviários,281,31270310,2,201,3,1,3,89,,Não,2,Possui loja de +- 29 m² com banheiro.,INQUILINO,Sim,Chave Comum,Local da Chave com Secretaria da Casa Mineira,Local da Chave com Secretaria da Casa Mineira,Não,[FS-CM],Sim,500000,650,150,Mensalmente,,,,,,1,Elemento não encontrado na pagina 'Aluguel',,
Casa Mineira,323877,22/02/2022,Sim,[FS-CM],Secretaria Casa Mineira,3125333000,secretaria@casamineira.com,Sim,,,Casa,Rua Aragão,220,30850300,,,3,1,3,267,,Não,3,"APARATAMENTO 02 QUARTOS TODO PLANEJADO COM 02 VAGAS PARALELO.  Apartamento 02 quartos com armários sendo 01 com sacada, elevador, sala com painel pra TV, mesa com espelho e lustre , cozinha planejada, área de lavanderia, ""02 VAGAS EM PARALELO"", prédio individual.",PROPRIETÁRIO,Sim,Chave Comum,Local da Chave com Secretaria da Casa Mineira,Local da Chave com Secretaria da Casa Mineira,Não,[FS-CM],Sim,750000,,190,Mensalmente,,,,,,1,Este imóvel está fora da área de atuação de venda.,,
Casa Mineira,367104,22/02/2022,Sim,[FS-CM],Secretaria Casa Mineira,3125333000,secretaria@casamineira.com,Sim,,,Cobertura,Rua Rodrigues Caldas,570,30190120,10,1001,4,2,3,266,,Não,4,"O apto - área privativa possui 61,73 M2 de área útil e 10,62 M2 de área privativa. São 02 vagas de garagem localizadas no 1º piso (cobertas sob pilotis) - de números 13 (presa) e 14 (livre). O imóvel possui esquadrias em alumínio com vidro temperado e excelente acabamento interno.",PROPRIETÁRIO,Sim,Chave Comum,Local da Chave com Secretaria da Casa Mineira,Local da Chave com Secretaria da Casa Mineira,Não,[FS-CM],Sim,2350000,2200,,Mensalmente,,,,,,1,Elemento não encontrado na pagina 'Detalhe do imovel',,
Casa Mineira,422788,22/02/2022,Sim,[FS-CM],Secretaria Casa Mineira,3125333000,secretaria@casamineira.com,Sim,,,Apartamento,Rua Cascavel,15,30535670,1,101,2,1,2,64,,Não,1,"O apto de cobertura possui 68,25M2 de área útil e 54,35M2 de terraço. São 03 vagas de garagem localizadas no 1º piso (cobertas sob pilotis / paralelas e livres) - de números 03, 05 e 06. O imóvel possui esquadrias em alumínio com vidro temperado e excelente acabamento interno.",PROPRIETÁRIO,Sim,Chave Comum,Local da Chave com Secretaria da Casa Mineira,Local da Chave com Secretaria da Casa Mineira,Não,[FS-CM],Sim,350000,320,,Mensalmente,,,,,,893580008,,2022-03-08 23:47,erro-sem_imgs
Casa Mineira,417431,22/02/2022,Sim,[FS-CM],Secretaria Casa Mineira,3125333000,secretaria@casamineira.com,Sim,,,Apartamento,Rua Ernani Agricola,601,30492040,4,401 B2,3,1,2,70,,Não,2,Geminada linear sem escada nenhuma.,PROPRIETÁRIO,Sim,Chave Comum,Local da Chave com Secretaria da Casa Mineira,Local da Chave com Secretaria da Casa Mineira,Não,[FS-CM],Sim,410000,540,130,Mensalmente,,,,,,893580028,,2022-03-08 23:48,erro-sem_imgs
Casa Mineira,316012,22/02/2022,Sim,[FS-CM],Secretaria Casa Mineira,3125333000,secretaria@casamineira.com,Sim,,,Apartamento,Rua Antônio Aleixo,330,30180153,5,501,4,2,3,210,,Não,2,O imóvel possui Habite-se,PROPRIETÁRIO,Sim,Chave Comum,Local da Chave com Secretaria da Casa Mineira,Local da Chave com Secretaria da Casa Mineira,Não,[FS-CM],Sim,1600000,1700,500,Mensalmente,,,,,,893580040,,2022-03-08 23:49,ok-img (2022-03-10 19:46:06)
Casa Mineira,101490,22/02/2022,Sim,[FS-CM],Secretaria Casa Mineira,3125333000,secretaria@casamineira.com,Sim,,,Flat,AVENIDA ALVARES CABRAL,1181,30170001,,1501,1,1,1,36,,Não,0,"AMPLO ESPAÇO GOURMET COM CHURRASQUEIRA , PISCINA DE 25 MIL LITROS COM CASCATA ( AQUECIMENTO SOLAR ) ELEVADOR COM ACESSO AO SEGUNDO NÍVEL ( VISTA PANORÂMICA )",PROPRIETÁRIO,Sim,Chave Comum,Local da Chave com Secretaria da Casa Mineira,Local da Chave com Secretaria da Casa Mineira,Não,[FS-CM],Sim,290000,,,Mensalmente,,,,,,1,Elemento não encontrado na pagina 'Detalhe do imovel',,
Casa Mineira,278063,22/02/2022,Sim,[FS-CM],Secretaria Casa Mineira,3125333000,secretaria@casamineira.com,Sim,,,Apartamento,Rua Contagem,330,31060237,3,301,2,0,1,54,,Não,0,,PROPRIETÁRIO,Sim,Chave Comum,Local da Chave com Secretaria da Casa Mineira,Local da Chave com Secretaria da Casa Mineira,Não,[FS-CM],Sim,220000,469,0,Mensalmente,,,,,,893580064,,2022-03-08 23:52,ok-img (2022-03-10 19:47:16)
Casa Mineira,264483,22/02/2022,Sim,[FS-CM],Secretaria Casa Mineira,3125333000,secretaria@casamineira.com,Sim,,,Apartamento,Rua Marechal Hermes,505,30441028,3,304,3,0,1,115,,Não,1,"Apartamento 3 quartos bem arejado , muito bem localizado , sendo 1 suítes , sala para 2 ambientes , varanda , cozinha com área de serviço separada, reformado e com armários",PROPRIETÁRIO,Sim,Chave Comum,Local da Chave com Secretaria da Casa Mineira,Local da Chave com Secretaria da Casa Mineira,Não,[FS-CM],Sim,500000,950,173,Mensalmente,,,,,,E,,,
Casa Mineira,350882,22/02/2022,Sim,[FS-CM],Secretaria Casa Mineira,3125333000,secretaria@casamineira.com,Sim,,,Apartamento,Rua Santa Catarina,1481,30170084,2,202,2,2,2,58,,Não,1,"* Frente * Closet * Varanda / Sacada * Claro / Arejado * Hidromassagem * Home Theater * Lareira * Aquec. Central de Água * Adega/Bar * Despensa * Área de Servico * Banho Empregada * Quarto Empregada * Vista Panorâmica * Acabamento Luxo * Teto Rebaixado * Decorado. Lote no condomínio Alphaville: Área 2039M , frente 40M X fundos 50M, geometria retangular, plano, murado, sugestão de construção: Só casa. Casa: Área construída 688M , área descoberta 1739M  / Spa p/ 6 pessoas, 1 banho, aquecimento solar, elevador, 1 loft p/ caseiro, box de despejo. 1  Andar: 2 salas p/ 4 ambientes, lareira, lavabo, cozinha ampla, dce, lavandeira, área de serviço / cozinha conjugada c/ espaço gourmet. 2  Andar: escada em alvenaria, estar íntimo, 5 quartos sendo 2 c/ varanda, 5 suítes c/ box de blindex, hidro na suíte master, closet em 3 suítes, cozinha de apoio /  Estar íntimo na suíte master. Garagem: 10 vagas sendo 8 cobertas e 2 descobertas. Vagas são 4 duplas e 2 em linha.",PROPRIETÁRIO,Sim,Chave Comum,Local da Chave com Secretaria da Casa Mineira,Local da Chave com Secretaria da Casa Mineira,Não,[FS-CM],Sim,730000,300,,Mensalmente,,,,,,893580086,,2022-03-08 23:54,ok-img (2022-03-10 19:48:56)
Casa Mineira,393055,22/02/2022,Sim,[FS-CM],Secretaria Casa Mineira,3125333000,secretaria@casamineira.com,Sim,,,Cobertura,Rua Juruena,165,30493170,7,701,3,1,3,214,,Não,2,"Lote: Zoneamento ZAp, CA 1.5, CHTU 40, área 360M , frente 12M X fundos 30M, murado. Casa: Área construída de 550M, área descoberta de 100M .",PROPRIETÁRIO,Sim,Chave Comum,Local da Chave com Secretaria da Casa Mineira,Local da Chave com Secretaria da Casa Mineira,Não,[FS-CM],Sim,978000,825,250,Mensalmente,,,,,,1,Elemento não encontrado na pagina 'Detalhe do imovel',,
Casa Mineira,339051,22/02/2022,Sim,[FS-CM],Secretaria Casa Mineira,3125333000,secretaria@casamineira.com,Sim,,,Casa,Rua Maria Rita,66,31160060,,,3,1,2,140,,Não,0,,INQUILINO,Sim,Chave Comum,Local da Chave com Secretaria da Casa Mineira,Local da Chave com Secretaria da Casa Mineira,Não,[FS-CM],Sim,350000,,,Mensalmente,,,,,,1,Elemento não encontrado na pagina 'Aluguel',,
Casa Mineira,414296,22/02/2022,Sim,[FS-CM],Secretaria Casa Mineira,3125333000,secretaria@casamineira.com,Sim,,,Apartamento,Rua Rubens Caporali Ribeiro,533,30575857,6,601 Bloco 1,3,1,2,83,,Não,2,,PROPRIETÁRIO,Sim,Chave Comum,Local da Chave com Secretaria da Casa Mineira,Local da Chave com Secretaria da Casa Mineira,Não,[FS-CM],Sim,700000,,,Mensalmente,,,,,,893580030,,2022-03-08 23:59,erro-sem_imgs
Casa Mineira,323897,22/02/2022,Sim,[FS-CM],Secretaria Casa Mineira,3125333000,secretaria@casamineira.com,Sim,,,Cobertura,Rua Itajubá,2225,31035540,4,401,2,1,3,110,,Não,3,,PROPRIETÁRIO,Sim,Chave Comum,Local da Chave com Secretaria da Casa Mineira,Local da Chave com Secretaria da Casa Mineira,Não,[FS-CM],Sim,570000,230,,Mensalmente,,,,,,1,Elemento não encontrado na pagina 'Detalhe do imovel',,
Casa Mineira,399042,22/02/2022,Sim,[FS-CM],Secretaria Casa Mineira,3125333000,secretaria@casamineira.com,Sim,,,Apartamento,Rua Herculano de Freitas,151,30441039,18,1802,4,2,4,178,,Não,4,Apartamento original / conservado,PROPRIETÁRIO,Sim,Chave Comum,Local da Chave com Secretaria da Casa Mineira,Local da Chave com Secretaria da Casa Mineira,Não,[FS-CM],Sim,2200000,,,Mensalmente,,,,,,893580057,,2022-03-09 0:01,erro-pag_fotos
Casa Mineira,343560,22/02/2022,Sim,[FS-CM],Secretaria Casa Mineira,3125333000,secretaria@casamineira.com,Sim,,,Apartamento,Avenida Cisne,160,34018010,4,404,2,1,2,72,,Não,2,,PROPRIETÁRIO,Sim,Chave Comum,Local da Chave com Secretaria da Casa Mineira,Local da Chave com Secretaria da Casa Mineira,Não,[FS-CM],Sim,610000,850,,Mensalmente,,,,,,1,Mapa não encontrado,,
Casa Mineira,401112,22/02/2022,Sim,[FS-CM],Secretaria Casa Mineira,3125333000,secretaria@casamineira.com,Sim,,,Apartamento,Rua Kimberlita,387,31010260,1,101,4,1,2,164,,Não,2,,PROPRIETÁRIO,Sim,Chave Comum,Local da Chave com Secretaria da Casa Mineira,Local da Chave com Secretaria da Casa Mineira,Não,[FS-CM],Sim,700000,,,Mensalmente,,,,,,893580074,,2022-03-09 0:03,ok-img (2022-03-10 19:51:57)
Casa Mineira,339829,22/02/2022,Sim,[FS-CM],Secretaria Casa Mineira,3125333000,secretaria@casamineira.com,Sim,,,Apartamento,Rua dos Tupis,1130,30190062,14,1406,1,0,1,58,,Não,0,"Apartamento todo reformado, inclusive hidráulica e elétrica e ricamente decorado. 1 quarto virou escritório, fez closet em um dos outros quartos, cozinha em ilha, espaço gourmet com churrasqueira elétrica, ar condicionado na suíte e sala de TV (preparação para ar nos outros quartos), lavanderia, aquecimento a gás na suíte e área externa.  Proprietário negocia todos os itens constantes no imóvel.",DESOCUPADO,Sim,Chave Comum,Local da Chave com Secretaria da Casa Mineira,Local da Chave com Secretaria da Casa Mineira,Não,[FS-CM],Sim,200000,335,,Mensalmente,,,,,,893580087,,2022-03-09 0:04,ok-img (2022-03-10 19:53:10)
Casa Mineira,280655,22/02/2022,Sim,[FS-CM],Secretaria Casa Mineira,3125333000,secretaria@casamineira.com,Sim,,,Apartamento,Rua Turquesa,1295,30411262,1,102,3,1,2,90,,Não,2,O elevador vai ate o segundo nivel da cobertura.,PROPRIETÁRIO,Sim,Chave Comum,Local da Chave com Secretaria da Casa Mineira,Local da Chave com Secretaria da Casa Mineira,Não,[FS-CM],Sim,565000,,,Mensalmente,,,,,,E,,,
Casa Mineira,411847,22/02/2022,Sim,[FS-CM],Secretaria Casa Mineira,3125333000,secretaria@casamineira.com,Sim,,,Apartamento,Rua Geraldina Cândida de Jesus,105,31330560,3,303,2,1,2,55,,Não,1,,INQUILINO,Sim,Chave Comum,Local da Chave com Secretaria da Casa Mineira,Local da Chave com Secretaria da Casa Mineira,Não,[FS-CM],Sim,320000,,,Mensalmente,,,,,,1,Pagina de proprietario não carregou,,
Casa Mineira,418430,22/02/2022,Sim,[FS-CM],Secretaria Casa Mineira,3125333000,secretaria@casamineira.com,Sim,,,Casa,Rua Mariana,110,31210420,,LOTE,1,0,1,300,,Não,1,"Um dos quartos foi transformado em sala, podendo ser revertido novamente para quarto.",PROPRIETÁRIO,Sim,Chave Comum,Local da Chave com Secretaria da Casa Mineira,Local da Chave com Secretaria da Casa Mineira,Não,[FS-CM],Sim,400000,,250,Mensalmente,,,,,,1,Este imóvel está fora da área de atuação de venda.,,
Casa Mineira,419509,22/02/2022,Sim,[FS-CM],Secretaria Casa Mineira,3125333000,secretaria@casamineira.com,Sim,,,Apartamento,Rua José Amaury Ferrara,75,30575280,6,602,4,1,2,130,,Não,2,"Um dos quartos foi revertido em closet.  O quarto do DCE foi transformado em despensa.  No registro está vaga para 3 carros, porem cabe 4.",PROPRIETÁRIO,Sim,Chave Comum,Local da Chave com Secretaria da Casa Mineira,Local da Chave com Secretaria da Casa Mineira,Não,[FS-CM],Sim,790000,1400,,Mensalmente,,,,,,893580230,,2022-03-09 0:08,erro-sem_imgs
Casa Mineira,320514,22/02/2022,Sim,[FS-CM],Secretaria Casa Mineira,3125333000,secretaria@casamineira.com,Sim,,,Apartamento,Rua Jandiatuba,11,30493135,3,301,2,1,2,85,,Não,2,,PROPRIETÁRIO,Sim,Chave Comum,Local da Chave com Secretaria da Casa Mineira,Local da Chave com Secretaria da Casa Mineira,Não,[FS-CM],Sim,530000,390,178,Mensalmente,,,,,,893580240,,2022-03-09 0:09,ok-img (2022-03-10 19:54:14)
Casa Mineira,278539,22/02/2022,Sim,[FS-CM],Secretaria Casa Mineira,3125333000,secretaria@casamineira.com,Sim,,,Casa,Rua Francisco Guimarães,156,30770060,,Casa,4,0,4,375,,Não,2,* Frente * Varanda / Sacada * Claro / Arejado * Área de Servico * Banho Empregada * Quarto Empregada * Iluminação Planejada. Garagem: 2 vagas cobertas e livres. Vagas que cabem 4 carros / São duas duplas.,PROPRIETÁRIO,Sim,Chave Comum,Local da Chave com Secretaria da Casa Mineira,Local da Chave com Secretaria da Casa Mineira,Não,[FS-CM],Sim,599000,,125,Mensalmente,,,,,,893580255,,2022-03-09 0:10,ok-img (2022-03-10 19:55:39)
Casa Mineira,278789,22/02/2022,Sim,[FS-CM],Secretaria Casa Mineira,3125333000,secretaria@casamineira.com,Sim,,,Cobertura,Rua Cachoeira do Campo,324,30411278,5,501,3,1,2,170,,Não,2,"Ótimo apartamento no 14° andar com vista espetacular! Claro, arejado, reformado, Varanda integrada à sala, armários. Infraestrutura: Ótimo prédio! Imponente, reformado, lazer, 2 elevadores, porteiro físico, belos jardins, hall decorado, salão de festas, piscina aquecida com vista panorâmica, academia bem equipada, quadra, sauna, churrasqueira, pilotis, playground, áreas livres amplas e 2 vagas cobertas que cabe um terceiro carro. Rua plana, localização privilegiada e próximo ao comércio. Prédio imponente com lazer e elevador *2 vagas cobertas que cabe um terceiro carro. DIFERENCIAIS DO IMÓVEL: Excluir “varanda” e “área de serviço”. DIFERENCIAIS DO EDIFÍCIO: Excluir “Guarita” e “interfone” ARMÁRIOS: Faltou incluir quartos, banho, rouparia e área de serviço.",PROPRIETÁRIO,Sim,Chave Comum,Local da Chave com Secretaria da Casa Mineira,Local da Chave com Secretaria da Casa Mineira,Não,[FS-CM],Sim,898000,400,220,Mensalmente,,,,,,1,Elemento não encontrado na pagina 'Detalhe do imovel',,
Casa Mineira,402098,22/02/2022,Sim,[FS-CM],Secretaria Casa Mineira,3125333000,secretaria@casamineira.com,Sim,,,Casa,Rua Ponta Grossa,144,30620180,,,5,0,3,270,,Não,1,"Condomínio 600,00 inclui agua e fundo de reserva. Gás a parte",PROPRIETÁRIO,Sim,Chave Comum,Local da Chave com Secretaria da Casa Mineira,Local da Chave com Secretaria da Casa Mineira,Não,[FS-CM],Sim,350000,,,Mensalmente,,,,,,1,Este imóvel está fora da área de atuação de aluguel.,,
Casa Mineira,277503,22/02/2022,Sim,[FS-CM],Secretaria Casa Mineira,3125333000,secretaria@casamineira.com,Sim,,,Apartamento,Rua Donato da Fonseca,849,30380260,4,401,4,1,2,230,,Não,2,"* Claro / Arejado * Despensa * Área de Servico * Banho Empregada * Quarto Empregada * Vista Panorâmica * Decorado. Lote: Zoneamento ZAR, ca 1/B, área 405M , frente 18M X fundos 23,61M, geometria retangular, plano, murado / sugestão de construção: Só casa. Casa: Área construída 344M , área descoberta 200M , 2 andares, revestimento em pintura, esquadrias em madeira / Fogão a lenha e espaço gourmet. 1  andar: sala, lavabo, cozinha clara, dce só banho, lavanderia / área de serviço. 2  andar: Escada em alvenaria, sala c/ varanda, 3 quartos, 2 suítes c/ box de blindex c/ hidro. Garagem: 5 vagas cobertas separadas.",PROPRIETÁRIO,Sim,Chave Comum,Local da Chave com Secretaria da Casa Mineira,Local da Chave com Secretaria da Casa Mineira,Não,[FS-CM],Sim,780000,600,350,Mensalmente,,,,,,893580285,,2022-03-09 0:13,erro-pag_fotos
Casa Mineira,233390,22/02/2022,Sim,[FS-CM],Secretaria Casa Mineira,3125333000,secretaria@casamineira.com,Sim,,,Flat,Rua Guaicuí,596,30380342,6,604,2,1,2,80,,Não,1,,DESOCUPADO,Sim,Chave Comum,Local da Chave com Secretaria da Casa Mineira,Local da Chave com Secretaria da Casa Mineira,Não,[FS-CM],Sim,724950,,,Mensalmente,,,,,,1,Elemento não encontrado na pagina 'Detalhe do imovel',,
Casa Mineira,233392,22/02/2022,Sim,[FS-CM],Secretaria Casa Mineira,3125333000,secretaria@casamineira.com,Sim,,,Flat,Rua Guaicuí,596,30380342,6,615,1,1,2,62,,Não,1,,DESOCUPADO,Sim,Chave Comum,Local da Chave com Secretaria da Casa Mineira,Local da Chave com Secretaria da Casa Mineira,Não,[FS-CM],Sim,540000,,,Mensalmente,,,,,,1,Elemento não encontrado na pagina 'Detalhe do imovel',,
Casa Mineira,233393,22/02/2022,Sim,[FS-CM],Secretaria Casa Mineira,3125333000,secretaria@casamineira.com,Sim,,,Flat,Rua Guaicuí,596,30380342,12,1212,1,1,2,52,,Não,1,,DESOCUPADO,Sim,Chave Comum,Local da Chave com Secretaria da Casa Mineira,Local da Chave com Secretaria da Casa Mineira,Não,[FS-CM],Sim,490000,,,Mensalmente,,,,,,1,Elemento não encontrado na pagina 'Detalhe do imovel',,
Casa Mineira,233394,22/02/2022,Sim,[FS-CM],Secretaria Casa Mineira,3125333000,secretaria@casamineira.com,Sim,,,Flat,Rua Guaicuí,596,30380342,12,1214,1,1,2,62,,Não,1,Predisposição pra aquecimento solar nos chuveiros,DESOCUPADO,Sim,Chave Comum,Local da Chave com Secretaria da Casa Mineira,Local da Chave com Secretaria da Casa Mineira,Não,[FS-CM],Sim,590000,,,Mensalmente,,,,,,1,Elemento não encontrado na pagina 'Detalhe do imovel',,
Casa Mineira,425249,22/02/2022,Sim,[FS-CM],Secretaria Casa Mineira,3125333000,secretaria@casamineira.com,Sim,,,Apartamento,Rua Itutinga,84,30535640,2,204,2,0,1,68,,Não,1,"Hidráulica e elétrica revisada. Telhado reformado. Caixas de água novas. Sistema de segurança com alarme e concertina eletrificada Interfone. Na esquina da rua tem padaria, supermercado, farmácia, pet shopping e outros comércios.",PROPRIETÁRIO,Sim,Chave Comum,Local da Chave com Secretaria da Casa Mineira,Local da Chave com Secretaria da Casa Mineira,Não,[FS-CM],Sim,255000,380,,Mensalmente,,,,,,893580353,,2022-03-09 0:20,erro-sem_imgs
Casa Mineira,329708,22/02/2022,Sim,[FS-CM],Secretaria Casa Mineira,3125333000,secretaria@casamineira.com,Sim,,,Cobertura,Rua Castigliano,618,30720310,3,302,3,1,2,146,,Não,2,,PROPRIETÁRIO,Sim,Chave Comum,Local da Chave com Secretaria da Casa Mineira,Local da Chave com Secretaria da Casa Mineira,Não,[FS-CM],Sim,580000,,,Mensalmente,,,,,,1,Elemento não encontrado na pagina 'Detalhe do imovel',,
Casa Mineira,385441,22/02/2022,Sim,[FS-CM],Secretaria Casa Mineira,3125333000,secretaria@casamineira.com,Sim,,,Apartamento,Rua João Edmundo Caldeira Brant,103,31710200,2,202,4,1,3,173,,Não,2,,PROPRIETÁRIO,Sim,Chave Comum,Local da Chave com Secretaria da Casa Mineira,Local da Chave com Secretaria da Casa Mineira,Não,[FS-CM],Sim,999000,500,304,Mensalmente,,,,,,893580378,,2022-03-09 0:22,ok-img (2022-03-10 19:59:35)
